{
  "schema": "scientific_report.v1",
  "task_id": "task.phase1.sample.report",
  "sprint_id": "sprint.scientific.phase1",
  "node_id": "node.report_draft",
  "status": "completed",
  "inputs": {
    "verdicts": ["sample_claim_verdict.v1.json"]
  },
  "outputs": {
    "report": {
      "report_id": "report.sample.001",
      "title": "Fixture Scientific Report",
      "sections": [
        {
          "section_id": "sec.findings",
          "title": "Findings",
          "evidence_ids": ["claim.sample.001", "experiment.sample.001"]
        }
      ],
      "evidence_ids": ["claim.sample.001", "experiment.sample.001"],
      "unsupported_claims": []
    }
  },
  "artifacts": [
    {
      "type": "markdown_report",
      "path": "artifacts/scientific/fixtures/scientific_report.md"
    }
  ],
  "provenance": {
    "operator_id": "ScientificReportDrafter",
    "implementation_package": "fixture.local",
    "timestamp": "2026-06-16T20:30:00Z"
  },
  "limitations": ["Fixture report demonstrates schema shape only."]
}
